{
  "$schema": "https://json-schema.org/draft/2020-12/schema",
  "version": "initializer-question-pack.v4",
  "goal": "Infer strong harness defaults first, then confirm only the decisions that materially change the generated repo-local workflow.",
  "decisionPoints": [
    {
      "id": "project_identity",
      "title": "Project Identity",
      "batch": 1,
      "questions": [
        "Project name",
        "Developer name",
        "One-line product brief"
      ],
      "required": true
    },
    {
      "id": "plan_selection",
      "title": "Plan Selection",
      "batch": 1,
      "questions": [
        "Choose core plan A-F or Custom Presets",
        "If Custom Presets: choose G/H/I/J/K"
      ],
      "required": true
    },
    {
      "id": "delivery_constraints",
      "title": "Delivery Constraints",
      "batch": 2,
      "questions": [
        "Team size",
        "MVP scope and acceptance criteria"
      ],
      "required": true
    },
    {
      "id": "runtime_defaults",
      "title": "Runtime Defaults",
      "batch": 2,
      "questions": [
        "Confirm inferred package manager",
        "Permission mode: Permissionless / Plan-only / Standard (default: Plan-only)",
        "Confirm commit policy"
      ],
      "required": true
    },
    {
      "id": "orchestration_profile",
      "title": "Orchestration Profile",
      "batch": 3,
      "questions": [
        "Confirm planner -> generator -> evaluator harness flow",
        "Override artifact strictness only if the team needs a lighter loop"
      ],
      "required": true
    },
    {
      "id": "evaluation_profile",
      "title": "Evaluation Profile",
      "batch": 3,
      "questions": [
        "Choose browser QA vs command QA default",
        "Any extra scoring dimensions or hard thresholds"
      ],
      "required": false
    },
    {
      "id": "context_profile",
      "title": "Context Profile",
      "batch": 3,
      "questions": [
        "Choose context profile: stable-root + progressive-subdir (default) or flat-root",
        "Confirm whether directory-level AGENTS.md files should be generated for multi-module repos"
      ],
      "required": false
    },
    {
      "id": "handoff_profile",
      "title": "Handoff Profile",
      "batch": 4,
      "questions": [
        "When should the repo force a handoff artifact",
        "Any custom handoff sections or restore expectations"
      ],
      "required": false
    },
    {
      "id": "resilience_profile",
      "title": "Recovery & State Profile",
      "batch": 4,
      "questions": [
        "Choose recovery policy: lesson-driven (default) or structured-guards",
        "Choose state policy: file-backed (default) or context-light"
      ],
      "required": false
    },
    {
      "id": "quality_rules",
      "title": "Quality Rules",
      "batch": 4,
      "questions": [
        "Project-specific prohibitions",
        "Any must-enforce compliance constraints"
      ],
      "required": false
    },
    {
      "id": "plugin_profile",
      "title": "Plugin Profile",
      "batch": 5,
      "questions": [
        "Install recommended global plugins",
        "Enable LSP set by stack"
      ],
      "required": false
    }
  ],
  "planTiers": {
    "core": [
      "A",
      "B",
      "C",
      "D",
      "E",
      "F"
    ],
    "presets": [
      "G",
      "H",
      "I",
      "J",
      "K"
    ]
  },
  "inferredDefaults": {
    "packageManagerPriority": [
      "bun",
      "pnpm",
      "npm"
    ],
    "runtimeProfile": "plan-only",
    "orchestrationProfile": "shared-long-running-harness",
    "evaluationProfile": "browser-qa",
    "handoffProfile": "artifact-aware",
    "recoveryProfile": "hybrid",
    "stateProfile": "file-backed",
    "contextProfile": "stable-root-progressive-subdir"
  },
  "runtimeProfiles": {
    "permissionless": {
      "label": "Plan + Permissionless",
      "claudePolicy": "--dangerously-skip-permissions",
      "codexPolicy": "sandbox_mode=danger-full-access, approval_policy=never"
    },
    "plan-only": {
      "label": "Plan-only (recommended)",
      "claudePolicy": "(default permissions)",
      "codexPolicy": "sandbox_mode=platform-default, approval_policy=on-failure"
    },
    "standard": {
      "label": "Standard (ask before each action)",
      "claudePolicy": "(default permissions)",
      "codexPolicy": "sandbox_mode=platform-default, approval_policy=always"
    }
  },
  "orchestrationProfiles": {
    "shared-long-running-harness": {
      "label": "Shared long-running harness",
      "description": "Default planner -> generator -> evaluator loop with repo-local artifacts and strict execution gates."
    },
    "lightweight-collaboration": {
      "label": "Lightweight collaboration",
      "description": "Keeps the artifact model but uses softer review and handoff gates."
    }
  },
  "evaluationProfiles": {
    "browser-qa": {
      "label": "Browser QA + evaluator rubric",
      "description": "Use browser-first QA evidence and UI-aware scoring when the plan includes a user-facing surface."
    },
    "command-qa": {
      "label": "Command QA + evaluator rubric",
      "description": "Use command/test/build evidence and reliability scoring when the plan is backend or TUI focused."
    }
  },
  "handoffProfiles": {
    "artifact-aware": {
      "label": "Artifact-aware handoff",
      "description": "Force a structured handoff artifact on context rollover, failed verification, and session stop."
    },
    "manual-handoff": {
      "label": "Manual handoff",
      "description": "Generate handoff artifacts on demand while keeping the same file format."
    }
  },
  "recoveryProfiles": {
    "lesson-driven": {
      "label": "Lesson-driven",
      "description": "Keep human-readable recovery prompts and use tasks/lessons.md as the primary improvement loop."
    },
    "structured-guards": {
      "label": "Structured guards",
      "description": "Emit standardized failure_class metadata from guards while keeping the same human-readable recovery text."
    },
    "hybrid": {
      "label": "Hybrid",
      "description": "Combine structured guard metadata with lesson-driven recovery and automatic handoff refresh."
    }
  },
  "stateProfiles": {
    "file-backed": {
      "label": "File-backed",
      "description": "Persist execution, verification, and handoff state to repo-local artifacts."
    },
    "context-light": {
      "label": "Context-light",
      "description": "Use the same workflow surface with fewer persisted state assumptions for lightweight repos."
    }
  },
  "contextProfiles": {
    "stable-root-progressive-subdir": {
      "label": "Stable root + progressive subdir",
      "description": "Keep the root contract small and expose subdirectory AGENTS.md files through a context map."
    },
    "flat-root": {
      "label": "Flat root",
      "description": "Keep a single root context surface for smaller repos that do not need nested context files."
    }
  }
}
